{
  "schemaVersion": "active-carrier-registry-v1",
  "canonicalOwner": "eval/catalogs/active-carriers-v1.json",
  "securityVetoRelationship": "SEPARATE_INDEPENDENT_GATE",
  "closedNotActiveRelations": [
    "CONTINUE",
    "EXTERNAL_NETWORK_MODEL",
    "GROUP_PUBLIC_DELIVERY",
    "HYBRID_RETRIEVAL",
    "LIVE_PROVIDER",
    "MCP_BROADER_THAN_LOCAL_ACQUIRE",
    "OPEN_CITATION_OUTSIDE_EVIDENCE_CONSOLE",
    "PRODUCTION_REMOTE_AUTH",
    "REMOTE_MULTIUSER_RUNTIME",
    "RUNTIME_REWRITE_RERANK_SELECT"
  ],
  "carriers": [
    {
      "id": "file-pgvector-acquire-v0",
      "status": "ACTIVE_BOUNDED",
      "statusOwner": {"path": "STATUS.md", "marker": "Bounded dogfood Runtime"},
      "authorityRefs": [
        {"path": "docs/decisions/0068-activate-loopback-dogfood-runtime.md", "marker": "Status: accepted"},
        {"path": "docs/decisions/0102-activate-release-bound-local-query-embedding.md", "marker": "Status: accepted"}
      ],
      "entrypointRefs": [
        {"path": "pyproject.toml", "marker": "context-engine-api"},
        {"path": "adapters/http/app.py", "marker": "/v0/resolve"},
        {"path": "adapters/pgvector.py", "marker": "PostgreSQLVectorCandidateIndex"}
      ],
      "migration": {"refs": [
        {"path": "migrations/versions/20260726_0036_fragment_embeddings.py", "marker": "20260726_0036"},
        {"path": "migrations/versions/20260802_0053_embedding_provider_profile.py", "marker": "20260802_0053"}
      ]},
      "highestPublicTestRefs": [
        {"path": "tests/integration/test_dogfood_runtime_activation.py", "marker": "test_dogfood_served_composition_delivers_release_scoped_file_evidence_before_limit"}
      ],
      "gateTargets": ["integration", "check"],
      "operatorDocRefs": [{"path": "README.md", "marker": "bounded served composition uses pgvector candidate discovery only"}],
      "notActiveRelations": ["CONTINUE", "HYBRID_RETRIEVAL", "PRODUCTION_REMOTE_AUTH", "REMOTE_MULTIUSER_RUNTIME", "RUNTIME_REWRITE_RERANK_SELECT", "EXTERNAL_NETWORK_MODEL", "LIVE_PROVIDER", "GROUP_PUBLIC_DELIVERY", "OPEN_CITATION_OUTSIDE_EVIDENCE_CONSOLE"]
    },
    {
      "id": "file-pgvector-acquire-v1",
      "status": "ACTIVE_BOUNDED",
      "statusOwner": {"path": "STATUS.md", "marker": "ADR-0104 activates the v1 cumulative public"},
      "authorityRefs": [
        {"path": "docs/decisions/0102-activate-release-bound-local-query-embedding.md", "marker": "Status: accepted"},
        {"path": "docs/decisions/0104-version-context-package-for-cumulative-runtime-accounting.md", "marker": "Status: accepted"}
      ],
      "entrypointRefs": [
        {"path": "adapters/http/app.py", "marker": "/v1/resolve"},
        {"path": "sdk/typescript-v1/README.md", "marker": "v1"}
      ],
      "migration": {"refs": [{"path": "migrations/versions/20260805_0056_tokenizer_profile_accounting.py", "marker": "20260805_0056"}]},
      "highestPublicTestRefs": [{"path": "tests/integration/test_z_egress_grant_file.py", "marker": "test_packed_typescript_sdk_resolves_authorized_file_package_over_live_http"}],
      "gateTargets": ["integration", "check"],
      "operatorDocRefs": [{"path": "README.md", "marker": "explicit `v1` accounting consumer"}],
      "notActiveRelations": ["CONTINUE", "HYBRID_RETRIEVAL", "PRODUCTION_REMOTE_AUTH", "REMOTE_MULTIUSER_RUNTIME", "RUNTIME_REWRITE_RERANK_SELECT", "EXTERNAL_NETWORK_MODEL", "LIVE_PROVIDER", "GROUP_PUBLIC_DELIVERY", "OPEN_CITATION_OUTSIDE_EVIDENCE_CONSOLE"]
    },
    {
      "id": "http-generated-sdk-v0",
      "status": "ACTIVE_BOUNDED",
      "statusOwner": {"path": "STATUS.md", "marker": "Freeze OpenAPI v0 through one sealed Runtime path"},
      "authorityRefs": [
        {"path": "docs/decisions/0047-freeze-openapi-v0-through-one-runtime-path.md", "marker": "Status: accepted"},
        {"path": "docs/decisions/0048-generate-typescript-sdk-behind-a-closed-facade.md", "marker": "Status: accepted"}
      ],
      "entrypointRefs": [{"path": "adapters/http/app.py", "marker": "/v0/resolve"}, {"path": "sdk/typescript/README.md", "marker": "v0"}],
      "migration": {"notApplicableRationale": "LOCAL_CONSUMER_REUSES_HTTP_RUNTIME_SCHEMA"},
      "highestPublicTestRefs": [{"path": "tests/integration/test_z_egress_grant_file.py", "marker": "test_packed_typescript_sdk_resolves_authorized_file_package_over_live_http"}],
      "gateTargets": ["integration", "check"],
      "operatorDocRefs": [{"path": "README.md", "marker": "OpenAPI v0 wire contract"}],
      "notActiveRelations": ["CONTINUE", "PRODUCTION_REMOTE_AUTH", "REMOTE_MULTIUSER_RUNTIME"]
    },
    {
      "id": "http-generated-sdk-v1",
      "status": "ACTIVE_BOUNDED",
      "statusOwner": {"path": "STATUS.md", "marker": "public v1 cumulative local-accounting contract"},
      "authorityRefs": [{"path": "docs/decisions/0104-version-context-package-for-cumulative-runtime-accounting.md", "marker": "Status: accepted"}],
      "entrypointRefs": [{"path": "adapters/http/app.py", "marker": "/v1/resolve"}, {"path": "sdk/typescript-v1/README.md", "marker": "v1"}],
      "migration": {"refs": [{"path": "migrations/versions/20260805_0056_tokenizer_profile_accounting.py", "marker": "20260805_0056"}]},
      "highestPublicTestRefs": [{"path": "tests/integration/test_z_egress_grant_file.py", "marker": "test_packed_typescript_sdk_resolves_authorized_file_package_over_live_http"}],
      "gateTargets": ["integration", "check"],
      "operatorDocRefs": [{"path": "README.md", "marker": "explicit `v1` accounting consumer"}],
      "notActiveRelations": ["CONTINUE", "PRODUCTION_REMOTE_AUTH", "REMOTE_MULTIUSER_RUNTIME", "EXTERNAL_NETWORK_MODEL", "RUNTIME_REWRITE_RERANK_SELECT"]
    },
    {
      "id": "file-supply-worker",
      "status": "ACTIVE_BOUNDED",
      "statusOwner": {"path": "STATUS.md", "marker": "File Provider (Provider #1) — Supply loop"},
      "authorityRefs": [{"path": "docs/decisions/0037-publish-first-file-through-exact-worker-lease.md", "marker": "Status: accepted"}, {"path": "docs/decisions/0071-compose-bounded-file-scan-cycles.md", "marker": "Status: accepted"}],
      "entrypointRefs": [{"path": "pyproject.toml", "marker": "context-engine-worker"}, {"path": "applications/worker.py", "marker": "def main"}],
      "migration": {"refs": [{"path": "migrations/versions/20260722_0006_worker_lease_noop.py", "marker": "20260722_0006"}, {"path": "migrations/versions/20260722_0010_file_source_registration.py", "marker": "20260722_0010"}]},
      "highestPublicTestRefs": [{"path": "tests/integration/test_connector_runner_lease.py", "marker": "test_worker_process_executes_exact_leased_file_connector_job"}],
      "gateTargets": ["integration", "check"],
      "operatorDocRefs": [{"path": "README.md", "marker": "context-engine-worker --dispatch-file-once"}],
      "notActiveRelations": ["LIVE_PROVIDER"]
    },
    {
      "id": "local-control-operator",
      "status": "ACTIVE_BOUNDED",
      "statusOwner": {"path": "STATUS.md", "marker": "opt-in ADR-0069 local operator process"},
      "authorityRefs": [{"path": "docs/decisions/0069-admit-an-explicit-local-operator-composition.md", "marker": "Status: accepted"}],
      "entrypointRefs": [{"path": "pyproject.toml", "marker": "context-engine-control"}, {"path": "applications/control.py", "marker": "def main"}],
      "migration": {"refs": [{"path": "migrations/versions/20260722_0010_file_source_registration.py", "marker": "20260722_0010"}]},
      "highestPublicTestRefs": [{"path": "tests/integration/test_control_operator_process.py", "marker": "test_control_process_registers_reads_and_activates_one_file_source"}],
      "gateTargets": ["integration", "check"],
      "operatorDocRefs": [{"path": "README.md", "marker": "context-engine-control register-file-source"}],
      "notActiveRelations": ["PRODUCTION_REMOTE_AUTH", "REMOTE_MULTIUSER_RUNTIME"]
    },
    {
      "id": "local-release-promotion",
      "status": "ACTIVE_BOUNDED",
      "statusOwner": {"path": "STATUS.md", "marker": "Bounded local Release promotion"},
      "authorityRefs": [{"path": "docs/decisions/0073-compose-explicit-release-candidates-from-current-corpus.md", "marker": "Status: accepted"}],
      "entrypointRefs": [{"path": "applications/release_promotion.py", "marker": "promote_release"}, {"path": "applications/control.py", "marker": "promote-release"}],
      "migration": {"refs": [{"path": "migrations/versions/20260722_0009_learning_release_promotion.py", "marker": "20260722_0009"}]},
      "highestPublicTestRefs": [{"path": "tests/integration/test_release_operator_process.py", "marker": "test_promote_release_activates_every_current_revision_and_dogfood_runtime"}],
      "gateTargets": ["integration", "check"],
      "operatorDocRefs": [{"path": "README.md", "marker": "context-engine-control promote-release"}],
      "notActiveRelations": ["REMOTE_MULTIUSER_RUNTIME"]
    },
    {
      "id": "repo-local-claude-acquire-v0",
      "status": "ACTIVE_BOUNDED",
      "statusOwner": {"path": "STATUS.md", "marker": "Repo-local Claude Code consumer"},
      "authorityRefs": [{"path": "docs/decisions/0088-bind-local-consumers-to-fresh-evidence-bearing-packages.md", "marker": "Status: accepted"}],
      "entrypointRefs": [{"path": ".claude/skills/context-engine/SKILL.md", "marker": "context-engine-local-context"}, {"path": "applications/local_context.py", "marker": "def main"}],
      "migration": {"notApplicableRationale": "WIRE_CARRIER_REUSES_RUNTIME_SCHEMA"},
      "highestPublicTestRefs": [{"path": "tests/unit/test_local_context.py", "marker": "test_skill_prescribes_stdin_only_invocation_without_bearer_material"}],
      "gateTargets": ["test", "check"],
      "operatorDocRefs": [{"path": "STATUS.md", "marker": "Repo-local Claude Code consumer"}],
      "notActiveRelations": ["CONTINUE", "OPEN_CITATION_OUTSIDE_EVIDENCE_CONSOLE", "GROUP_PUBLIC_DELIVERY"]
    },
    {
      "id": "maintainer-context-cli-acquire-v0",
      "status": "ACTIVE_BOUNDED",